Peter Costea,PeterCosteaEuroparlamentar,1.00045E+14,PERSON,RO,"Președinte Alianța Renașterea Națională

https://costea-parlamentuleuropean.ro/c-v-peter-costea/",12/30/2013 19:27,23393,26235,2023-06-02 11:44:09 EET,6/2/2023,11:44:09,Status,33,11,0,14,0,0,1,6,0,1,,-,0,0,0,N/A,https://www.facebook.com/100044605891725/posts/801260651370791,"Depresia și deznădejdea la copiii Cu prilejul Zilei Internaționale a Copiilor e bine să ne uităm în oglindă și să ne întrebăm în ce măsură – și nu dacă – suntem noi, adulții, responsabili pentru depresia acută și deznădejdea cu care se confruntă copiii și adolescenții. Conform unor studiilor recente, niciodată în istoria omenirii nu au fost tinerii și copiii atât de deprimați pe cât sunt astăzi. [Link: The Moral Paralysis behind Teenage Depression / Paralizia morală din spatele depresiei la adolescenți: https://www.thepublicdiscourse.com/2023/05/89058/] Da, astăzi, în zilele în care valorile tradiționale deja au fost distruse, și fiecare dintre noi, inclusiv copiii și adolescenții, pot să facă ce vor și ce li se pare bine în ochii lor. Niciodată în istoria omenirii nu au fost copiii și adolescenții mai „liberi” și „emancipați” de sub tutela regulilor tradiționale de conduită morală ca astăzi. Emanciparea adusă ca urmare a revoluției sexuale, a științelor sociale, a psihologiei și a medicinei, i-a făcut pe adolescenți și copii mai deprimați decât oricând în istorie. Concluzia asta nu este o simplă intuiție a mea. Este, afirmă articolul de mai sus, concluzia experților și a studiilor care se publică periodic. Conform studiilor recente, ""society has taught children and youth that the wrong things make them happy / societatea i-a învățat pe copii și tineri că lucrurile rele îi fac fericiți”. De asemenea, aceleași studii concluzionează că tinerii și copiii ""have not been given enough tools for moral thinking and acting / nu au primit suficiente unelte pentru a gândi și acționa moral”. Educația sexuală i-a separat pe copii de părinți, iar părinților nu li se mai permite să aibă un rol viabil în educația copiilor lor. În februarie, Center for Disease Control / Centrul pentru controlul bolilor din Atlanta, a publicat un studiu conform căruia 57% din fetele de liceu exprimă sentimente persistente de tristețe și deznădejde. În 2011, procentul acesta era de doar 36%. La băieți, procentul era de 29% în 2022 și de 21% în 2011. 30% dintre fete se gândesc în mod serios să se sinucidă, și 14% dintre băieți simt la fel. Depresia și disfuncționalitățile mintale și cognitive sunt mai pronunțate la fete decât la băieți, iar o majoritate dintre femeile care se consideră „progresiste” suferă de depresie și deformări emoționale și mintale. În Canada, jumătate dintre tineri iau pastile / are on meds, pentru a putea funcționa normal la nivel mintal și cognitiv. Diferențele în sănătatea mintală sunt, de asemenea, mari între „progresiști” și persoanele tradiționale. Progresiștii cunosc o incidență mult mai mare de depresie decât conservatorii. În mare parte, responsabilitatea pentru declinul atât de vertiginos în stabilitatea mintală a copiilor și adolescenților se datorează, spun experții, „liderilor progresiști” care conving tinerii că sunt – și vor rămâne – nefericiți, atât timp cât părinții lor continuă să impună restricții asupra comportamentului lor. Mai mult de o treime dintre adolescenții americani nu știu ""what makes anything morally right or wrong / ce face un anumit lucru bun sau rău din punct de vedere al moralității”. Eu, însă, prefer să pun responsabilitatea pe noi, adulții, generația mea și generația de dinaintea mea. Trei sau patru generații la rând, începând cu anii 50, au rupt barierele care delimitau moralul de imoral și binele de rău. Aceste generații au legalizat și dat generațiilor cărora le-au dat viață toate păcatele sociale cu care ne confruntăm astăzi: avort, sodomie, imoralitate sexuală, pornografie, transgenderism, divorț, concubinaj, destrămarea familiei și a căsătoriei, depresie, hedonism și alte lucruri ca acestea. Depresia s-a acumulat de la o generație la alta, așa cum studiile de mai sus indică. Revenirea la normal trebuie să înceapă cu generația mea. Generația mea și a celor de dinaintea mea i-a dus pe tinerii de astăzi în această stare de depresie și gândire la suicid și tot noi trebuie să demarăm schimbarea lucrurilor. Dacă ne pasă de copii, e vremea să acționăm. Acum, nu mâine. Cu tragere de inimă. Alătură-te Alianței Renașterea Națională! Vă rugăm să alocați câteva secunde pentru a completa formularul de contact: https://aliantarenastereanationala.ro/contact:=:https://aliantarenastereanationala.ro/contact/",,,,,,,,,33,-2.73
ActiveNews,activenewsro,1.00064E+14,NEWS_SITE,RO,Follow us on https://t.me/activenewsro. ActiveNews este un site de informații și știri necenzurat,10/13/2013 22:01,89763,90725,2023-06-04 14:53:13 EET,6/4/2023,14:53:13,Link,33,24,1,4,4,0,0,0,0,0,,-,0,0,0,N/A,https://www.facebook.com/100063785333040/posts/703332675136237,https://www.activenews.ro/stiri/Guvernatorul-republican-al-Texasului-Greg-Abott-a-semnat-legea-care-interzice-medicamentele-blocante-pentru-pubertate-si-interventiile-chirurgicale-pentru-tranzitia-de-gen-la-copii-182432,https://www.activenews.ro/stiri/Guvernatorul-republican-al-Texasului-Greg-Abott-a-semnat-legea-care-interzice-medicamentele-blocante-pentru-pubertate-si-interventiile-chirurgicale-pentru-tranzitia-de-gen-la-copii-182432,,,"Guvernatorul republican al Texasului, Greg Abott, a semnat legea care interzice medicamentele blocante pentru pubertate și intervențiile chirurgicale pentru ”tranziția de gen” la copii","Texasul a interzis medicamentele blocantele pentru pubertate, hormonii sexuali încrucișați și intervențiile chirurgicale pentru copiii cu tulburări de gen, informează ...",,,,33,1.1
ActiveNews,activenewsro,1.00064E+14,NEWS_SITE,RO,Follow us on https://t.me/activenewsro. ActiveNews este un site de informații și știri necenzurat,10/13/2013 22:01,89749,90711,2023-06-02 14:10:41 EET,6/2/2023,14:10:41,Link,33,6,0,11,0,3,0,2,11,0,,-,0,0,0,N/A,https://www.facebook.com/100063785333040/posts/701880088614829,The Guardian: Producătorii de pesticide au ascuns de autoritățile europene studiile privind toxicitatea pentru creier,https://www.activenews.ro/stiri/The-Guardian-Producatorii-de-pesticide-au-ascuns-de-autoritatile-europene-studiile-privind-toxicitatea-pentru-creier-182402,,,The Guardian: Producătorii de pesticide au ascuns de autoritățile europene studiile privind toxicitatea pentru creier,"Companiile producătoare de pesticide nu au dezvăluit autorităților europene de reglementare o serie de studii care evaluează toxicitatea cerebrală, deși aceleași studii au fost prezentate ...",,,,33,1
Sorin Rosca Stanescu,srstanescu,1.00045E+14,JOURNALIST,RO,"Jurnalist de investigatii extrem de incisiv, imi asum riscuri majore in lupta impotriva hotiei si ne",11/1/2012 10:27,75678,76510,2023-06-02 08:17:19 EET,6/2/2023,8:17:19,Link,33,24,6,3,0,0,0,0,0,0,,-,0,0,0,N/A,https://www.facebook.com/100044539801836/posts/806436717517648,,http://www.corectnews.com/politics/surprize-de-propor-ii-la-bulboaca,,,Surprize de proporții la Bulboaca,"La Bulboaca, o localitate din Republica Moldova până de curând total necunoscută în Europa, au avut loc câteva evenimente notabile. O absență importantă, insuficient explicată a lui Erdogan, o apariție surpriză a lui Zelenski, dar și o ofertă spectaculoasă, dacă nu cumva halucinantă...",,,,33,-1.55
Radio Gold FM Romania,radiogoldfmromania,1.00064E+14,RADIO_STATION,RO,Radio Gold FM Romania. Va asteptam pe frecventa 96.9FM,10/28/2011 11:05,46759,67074,2023-06-03 13:43:00 EET,6/3/2023,13:43:00,YouTube,32,29,0,1,1,0,0,1,0,0,,-,0,0,0,N/A,https://www.facebook.com/100063623349419/posts/739366761527429,Tot mai departe de Europa - Ia Pastila SRS! ,https://youtu.be/LT2cqVRnkKc,https://www.youtube.com/watch?v=LT2cqVRnkKc,,Tot mai departe de Europa - Ia Pastila SRS!,,,,,32,-1.12
Dana Budeanu,dana.budeanu.79,1.00004E+14,,,,,762362,N/A,2023-06-03 16:25:25 EET,6/3/2023,16:25:25,Link,32,29,0,0,2,1,0,0,0,0,,-,0,0,0,N/A,https://www.facebook.com/dana.budeanu.79/posts/2603942393091533,👀,https://app.verdictapp.com/article/40887,,,VRAJEALA PÃ ANOREXIE!,VERDICT MEDIA,,,,32,-4.16
ActiveNews,activenewsro,1.00064E+14,NEWS_SITE,RO,Follow us on https://t.me/activenewsro. ActiveNews este un site de informații și știri necenzurat,10/13/2013 22:01,89754,90717,2023-06-03 17:14:26 EET,6/3/2023,17:14:26,Link,32,27,2,3,0,0,0,0,0,0,,-,0,0,0,N/A,https://www.facebook.com/100063785333040/posts/702776331858538,Erdogan a depus jurământul pentru al treilea mandat prezidențial: ”Jur să apăr existența și independența Statului”,https://www.activenews.ro/stiri/Erdogan-a-depus-juramantul-pentru-al-treilea-mandat-prezidential-Jur-sa-apar-existenta-si-independenta-Statului-182421,,,Erdogan a depus jurământul pentru al treilea mandat prezidențial: ”Jur să apăr existența și independența Statului”,"Președintele turc Recep Tayyip Erdogan a depus sâmbătă jurământul pentru al treilea mandat prezidențial cu o durată de cinci ani, într-o ceremonie desfășurată la parlamentul din Ankara, ...",,,,32,1.03
ActiveNews,activenewsro,1.00064E+14,NEWS_SITE,RO,Follow us on https://t.me/activenewsro. ActiveNews este un site de informații și știri necenzurat,10/13/2013 22:01,89749,90711,2023-06-02 12:03:58 EET,6/2/2023,12:03:58,Link,32,6,3,4,0,2,17,0,0,0,,-,0,0,0,N/A,https://www.facebook.com/100063785333040/posts/701825331953638,https://www.activenews.ro/stiri/Reactia-lui-Biden-dupa-ce-a-cazut-pe-scena-Am-fost-subminat-.-Ghinionul-l-a-urmarit-pe-presedinte-pana-la-urcarea-in-avion-unde-s-a-lovit-de-tocul-usii-182401,https://www.activenews.ro/stiri/Reactia-lui-Biden-dupa-ce-a-cazut-pe-scena-Am-fost-subminat-.-Ghinionul-l-a-urmarit-pe-presedinte-pana-la-urcarea-in-avion-unde-s-a-lovit-de-tocul-usii-182401,,,"Reacția lui Biden, după ce a căzut pe scenă: ”Am fost subminat”. Ghinionul l-a urmărit pe președinte până la urcarea în avion, unde s-a lovit de tocul ușii","Președintele american Joe Biden a reacționat ironic după ce a s-a împiedicat și a căzut pe o scenă amplasată în campusul Academiei Forțelor Aeriene, din Colorado, unde fusese invitat să ...",,,,32,-1.03
evz.ro,evz.ro,1.00065E+14,NEWS_SITE,RO,Cel mai bun portal de stiri. Știri la zi. Emisiuni TV tip pamflet. Dezvăluiri istorice. Anchete și in,6/3/2010 12:13,140179,253473,2023-06-04 07:30:28 EET,6/4/2023,7:30:28,Native Video,32,22,1,5,0,0,0,4,0,0,owned,Yes,278,288,0,0:09:12,https://www.facebook.com/100064545585845/posts/659064969588350,"Baba Vanga a greşit profeţia despre România Omenirea se află, din nou, la o răspântie. Lumea se schimbă rapid sub ochii noștri. Am simțit asta pe propria noastră piele, mai cu seamă în ultimii ani. Drepturile și libertățile cetățenești, adică ceea ce constittuia fundamentul unei societăți democratice, statul de drept au fost în multe rânduri suprimate total sau parţial. Presa liberă, fără de care nu poate fi concepută o socitate democratică, în multe dintre țările lumii, practic, nu mai există. Câinele de pază al democraţiei, ori a murit, ori a turbat.",https://www.facebook.com/evz.ro/videos/3069870949826157/,,,Baba Vanga a greşit profeţia despre România,,,,,32,-3.06
Radio Gold FM Romania,radiogoldfmromania,1.00064E+14,RADIO_STATION,RO,Radio Gold FM Romania. Va asteptam pe frecventa 96.9FM,10/28/2011 11:05,46750,67070,2023-06-02 10:30:02 EET,6/2/2023,10:30:02,Photo,31,27,2,0,1,0,1,0,0,0,,-,0,0,0,N/A,https://www.facebook.com/100063623349419/posts/738379138292858,"MIHAI RUSU și PETRIȘOR PEIU azi la GOLD FM. “Dincolo de propagandă” cu Andrei Gușă Azi de la 13:30 cu Mihai Rusu, despre politizarea exacerbată a lumii sportului, cu studiu de caz Roland Garros: cum s-a ajuns ca spectatorii unui meci să fluiere o sportivă ucraineancă? Au fost aceștia îndreptățiți? Este de bun augur faptul că marele campion Novak Djokovic amestecă tenisul cu politica, sau este o acțiune reprobabilă? Vor participa sportivii ruși la Jocurile Olimpice, respectiv de ce nu le este acestora permis să concureze sub steagul țării lor, în condițiile în care competițiile sportive internaționale nu se rezumă la concurenți proveniți din țări NATO? Cum se descurcă sportivii români la Roland Garros după prima săptămână de concurs? Vom discuta și despre situația de ansamblu a sportului românesc, în an preolimpic. De la 14:15 cu Petrișor Peiu, despre cum va fi UE afectată de creșterea plafonului de îndatorare al SUA, în condițiile în care țările BRICS afirmă faptul că ar vrea să se debaraseze de dolarul american? În ce măsură a reușit UE să implementeze planul de creștere inteligentă, sustenabilă și inclusivă, asumat acum 13 ani? Cum se prezintă piața forței de muncă autohtonă? Cum putem interpreta ultimele date Eurostat referitoare la procentul de copii rezidenți în UE care au nevoi medicale nesatisfăcute, respectiv la tinerii care nu sunt angajați, dar nici nu frecventează școala? Care este situația reală în privința (dubiosului) parteneriat public-privat care vizează producția de energie nucleară? Vom discuta și despre cele mai mari îngrijorări ale românilor în anul 2023. Vineri de la 13.00 la 15.00, “DINCOLO DE PROPAGANDĂ!”, la Radio GOLD FM pe 96,9 MHz în București și împrejurimi, iar în toată țara și diaspora, pe internet, la goldtv.ro, radiogoldfm.ro sau căutând GOLD FM LIVE!",https://www.facebook.com/photo.php?fbid=738379114959527&set=a.439547628176012&type=3,,DINCOLO DE PROPAGANDA Andrei GUȘĂ VINERI INTRE 13:00- -15:00,,,,,,31,-1.52
Peter Costea,PeterCosteaEuroparlamentar,1.00045E+14,PERSON,RO,"Președinte Alianța Renașterea Națională

https://costea-parlamentuleuropean.ro/c-v-peter-costea/",12/30/2013 19:27,23395,26237,2023-06-03 11:29:50 EET,6/3/2023,11:29:50,Link,31,16,1,12,0,0,2,0,0,0,,-,0,0,0,N/A,https://www.facebook.com/100044605891725/posts/801820947981428,"Semnați petiția împotriva plăților pentru avort din banii noștri https://aliantarenastereanationala.ro/petitii/petitie-solicitam-respingerea-proiectului-legii-255-2023/ Petiție: Solicităm respingerea proiectului Legii 255/2023 Petiții | 19/05/2023 Solicităm respingerea proiectului Legii 255/2023 care urmărește facilitarea cât mai mult a avortului la cerere prin oferirea gratuității avortului. Plățile pentru avort urmează să fie făcute de Casa Națională de Asigurări de Sănătate, bani ce urmează a fi plătiți de contribuabili. Declinul demografic al României e de netăgăduit și duce țara pe râpa, iar instituirea prin lege a gratuității avortului va agrava declinul demografic. Proiectul Legislativ a fost inițiat de Partidul REPER - partidul condus de Dacian Cioloș si Dragoș Pîslaru. România are nevoie de un viitor. Viitorul vine doar prin nașterea de copiii. Solicităm respingerea acestui proiect legislativ cât și adoptarea de către Guvern și Parlament a unor legi desemnate să sprijine femeile în criza de sarcină și să asigure revenirea demografică a țării. Semnati: https://aliantarenastereanationala.ro/petitii/petitie-solicitam-respingerea-proiectului-legii-255-2023/ Cum se semnează Petiția? Semnarea Petiției se face în două etape. Accesați linkul: https://aliantarenastereanationala.ro/petitii/petitie-solicitam-respingerea-proiectului-legii-255-2023/ și semnați Petiția. După aceea veți primi un mesaj care vă va cere să confirmați semnătura apăsând pe un link de confirmare. Fără confirmarea semnăturii, numele și semnătura dvs. nu vor apărea în lista semnatarilor. Linkul de confirmare a semnăturii apare în limba engleză cu următorul text: “Thanks for filling out our petition, you’re almost done! Please confirm your signature by clicking on the link below:” (Adică: „Mulțumim pentru că ați completat formularul petiției. Semnarea petiției este aproape gata. Vă rugăm să vă confirmați semnătura apăsând pe linkul de mai jos”). Important: Petiția acceptă doar o singură semnătură de adresă electronică. Ca atare, sugerăm ca în situațiile unde două persoane folosesc aceeași adresă electronică, de exemplu soțul și soția, semnătura să fie dată în numele ambilor soți, de exemplu „Ioan și Maria Ionescu”. Rugăminte: Vă rugăm semnați Petiția cu numele întreg, nu doar cu inițiale. Vă mulțumim. Vă rugăm, de asemenea, să distribuiți Petiția la cât mai multe persoane.",https://aliantarenastereanationala.ro/petitii/petitie-solicitam-respingerea-proiectului-legii-255-2023/,,,Petiție: Solicităm respingerea proiectului Legii 255/2023 - Alianța Renașterea Națională,"Solicităm respingerea proiectului Legii 255/2023 care urmărește facilitarea cât mai mult a avortului la cerere prin oferirea gratuității avortului.Plățile pentru avort urmează să fie făcute de Casa Națională de Asigurări de Sănătate, bani ce urmează a fi plătiți de contribuabili.D...",,,,31,-2.26
Oficial Media,,1.00064E+14,NEWS_SITE,RO,"OFICIAL MEDIA - FII OM!
Cotidian de opinie, informare si atitudine. Promovare și imagine.
",1/9/2011 22:38,32048,34676,2023-06-04 17:50:11 EET,6/4/2023,17:50:11,Photo,31,10,1,20,0,0,0,0,0,0,,-,0,0,0,N/A,https://www.facebook.com/100063573431135/posts/727971029332005,"Alături de managerul Teatrului Tony Bulandra și președintele Festivalului Babel, Mihai Constantin Ranin, au fost prezenți: Jeungwoo Son, președintele Asociației Coreene de Teatru; Emil Boroghină, directorul fondator al Festivalului Internaţional Shakespeare, Preşedinte al Fundaţiei William Shakespeare Craiova; Hugo Wolff, coregraful spectacolului Argonautas; Bogdan Constantin, autorul expoziției de grafică şi pictură ”FORMAlități” din Foaierul Teatrului Tony Bulandra; Cornel Mihalache, regizorul documentarului Babel, ediția a 10-a. https://oficialmedia.com/argonautas-prima-coproductie-romano-coreeana-se-joaca-la-teatrul-tony-bulandra-targoviste/",https://www.facebook.com/photo.php?fbid=727966482665793&set=a.727971005998674&type=3,,,Photos from Oficial Media's post,,,,,31,1.24
Radio Gold FM Romania,radiogoldfmromania,1.00064E+14,RADIO_STATION,RO,Radio Gold FM Romania. Va asteptam pe frecventa 96.9FM,10/28/2011 11:05,46768,67084,2023-06-04 15:07:07 EET,6/4/2023,15:07:07,YouTube,29,23,3,0,1,2,0,0,0,0,,-,0,0,0,N/A,https://www.facebook.com/100063623349419/posts/740218601442245,China acuzată de furt de piloți - la pastila SRS! ,https://youtu.be/NP-PkWfKWrc,https://www.youtube.com/watch?v=NP-PkWfKWrc,,China acuzată de furt de piloți - la pastila SRS!,,,,,29,-1.24
Radio Gold FM Romania,radiogoldfmromania,1.00064E+14,RADIO_STATION,RO,Radio Gold FM Romania. Va asteptam pe frecventa 96.9FM,10/28/2011 11:05,46759,67074,2023-06-03 11:17:22 EET,6/3/2023,11:17:22,YouTube,29,19,1,2,1,1,4,0,1,0,,-,0,0,0,N/A,https://www.facebook.com/100063623349419/posts/739302768200495,https://youtu.be/sgWsJwvS2FI:=:https://www.youtube.com/watch?v=sgWsJwvS2FI,https://youtu.be/sgWsJwvS2FI,https://www.youtube.com/watch?v=sgWsJwvS2FI,,Falimentul SUA amanat pana in 2025 - Ia pastila SRS!,,,,,29,-1.28
Oana Lovin,OanaLovinElena963,1.00065E+14,SOCIAL_SERVICES,RO,Fun,2/6/2021 12:51,33626,52765,2023-06-02 21:06:41 EET,6/2/2023,21:06:41,Photo,29,24,3,0,0,0,2,0,0,0,,-,0,0,0,N/A,https://www.facebook.com/100065243010252/posts/730221879162573,"Doamna Senator AUR, Boancă, a ajuns la vorbele mele, la vorbele unei biete videochatiste. Of, cine n-are o videochatistă în viață, să-și cumpere.",https://www.facebook.com/photo.php?fbid=730221849162576&set=a.529319752586121&type=3,,"Senator Rodica Boancă 2h Am avut și niște frați Am ajutat când erau neajutorați... Û 166 III Îmi place 132 comentarii 22 distribuiri Comentează Distribuie Eugen Ilie Fetita Nu se ÃnÈ›elege mare lucru din postare, fiecare interpretează după cum consideră. Îmi place Răspunde 2 Senator Rodica Boancă Nu eu sunt trădată, ci toți românii! Îmi place Răspunde 23",,,,,,29,-5.55
Adriana Bahmuteanu Official,,1.00044E+14,PERSON,RO,Sunt ceea ce îmi doresc sa fiu!!! ,2/3/2015 20:44,241636,285727,2023-06-04 11:47:46 EET,6/4/2023,11:47:46,Photo,29,13,8,3,0,3,0,0,1,1,,-,0,0,0,N/A,https://www.facebook.com/100044152373697/posts/809368930544845,"Deci rămânem la "" Mars, ma!"".... https://www.stiripesurse.ro/absolut-rusinos-persoana-care-a-moderat-greva-profesorilor-nu-are-studii-superioare-si-a-luat-nota-4-la-admiterea-in-liceu_2941360.html",https://www.facebook.com/photo.php?fbid=809368910544847&set=a.205811550900589&type=3,,,,,,,,29,-11.45
ActiveNews,activenewsro,1.00064E+14,NEWS_SITE,RO,Follow us on https://t.me/activenewsro. ActiveNews este un site de informații și știri necenzurat,10/13/2013 22:01,89754,90717,2023-06-04 01:54:38 EET,6/4/2023,1:54:38,Link,28,11,0,11,5,0,0,0,0,1,,-,0,0,0,N/A,https://www.facebook.com/100063785333040/posts/702991911836980,4 iunie 1920: 103 ani de la semnarea Tratatului de la Trianon,https://www.activenews.ro/cultura-istorie/4-iunie-1920-103-ani-de-la-semnarea-Tratatului-de-la-Trianon-115273,,,4 iunie 1920: 103 ani de la semnarea Tratatului de la Trianon,"Tratatul de la Trianon a fost semnat la data de 4 iunie 1920 între Puterile Aliate învingătoare în Primul Război Mondial și Ungaria, în calitate de stat succesor al Imperiului Austro-Ungar, ...",,,,28,-1.07
ActiveNews,activenewsro,1.00064E+14,NEWS_SITE,RO,Follow us on https://t.me/activenewsro. ActiveNews este un site de informații și știri necenzurat,10/13/2013 22:01,89749,90711,2023-06-02 12:04:46 EET,6/2/2023,12:04:46,Link,28,18,2,3,1,1,0,1,2,0,,-,0,0,0,N/A,https://www.facebook.com/100063785333040/posts/701825638620274,"”Face raiduri în Transilvania, ne jignește istoria”. Dîncu, furibund: Președinta Ungariei trebuie interzisă în România",https://www.activenews.ro/opinii/Face-raiduri-in-Transilvania-ne-jigneste-istoria-.-Dincu-furibund-Presedinta-Ungariei-trebuie-interzisa-in-Romania-182397,,,"”Face raiduri în Transilvania, ne jignește istoria”. Dîncu, furibund: Președinta Ungariei trebuie interzisă în România","Fostul ministru Vasile Dîncu reacționează cu o neașteptată duritate la ultima vizită în România a președintei Ungariei, Katalin Novak, cu noua sfidare la adresa românilor, promovarea ...",,,,28,-1.18
